comment,context
구속해도 관리할 방법이없음... 교도소 시설이 구려서,"['전장연 휠체어 돌진으로 아킬레스건 끊어졌다… 경찰이 블라인드에 올린 하소연', 'ㄷㄷ 미친 https:www.cmcglr.comnewsarticleView.html?idxno=1905', '전장연 뉴스기사 보면 맨날 나오는 휠체어 앞에 철판 달은 놈 있는데 그 놈인가보네 왜 구속 안시키는지 ㅋㅋ']"
불법시위라는건 시작때부터 알고있었음 그냥 못건드린거지,"['전장연 시위시작', '전장연 : 이제 어디에서 시위할지 알려주는건 8시에 하겠다 오늘 혜화역 시작 정보)기재부 장관 면담전까지 평일내내 시위하겠다 선언 본인 4호선 출근러라 화딱지나는중..', '출근길 테러지.']"
오 랩퍼 제동이,"['오늘자 전장연 지지한 래퍼 ㄷㄷㄷㄷ', '비프리 의외네?ㅋㅋㅋㅋㅋ', '지하철 이용하지 않는 사람들+사회뉴스 무관심 = 아직도 전장연 지지하고 있다 이게 현실임']"
처음에 국힘 의원들이 상세 내용을 확인하겠다 정도도 아니고 김예지의원을 시작으로 안철수 나경원 등등 전부 다 전장연이 약자임을 강조하면서 편들어준게 빌드업이라고 진심으로 생각함? 빌드업이라는거는 하나를 이끌어내기 위해 계단을 밟아나가는 과정을 말하는건데 명백히 전장연을 옹호하는 이야기가 주류였던것도 사실이고 애시당초 이준석이 전장연을 까기 시작한것도 시위시작 직후가 아니라 몇달이 지난 후임 거기서 옹호한 것 때문에 이도저도 못하다 화물연대때 강경진압해보고 생각보다 효율이 좋게나오니 인제와서 하는척 하는거를 빌드업이라고 하는건 너무 나간 이야기같음,"['오늘자 전장연 지지한 래퍼 ㄷㄷㄷㄷ', '비프리 의외네?ㅋㅋㅋㅋㅋ', '내가 한 말이 국힘옹호로 결론나는 이유좀 쪽지로라도 꼭 알려주고가라. 너한테 뭐라고 따지는건 아니고, 나도 이준석 토사구팽한 국힘을 옹호하는걸로 보이기는 싫으니까 내가 몰랐던 부분이 있으면 지금 알고 가게']"
예전에 bts 대 놓고 까던거 생각나네 1집으로 등장했을때 좋았는데 ㅋㅋㅋ,"['오늘자 전장연 지지한 래퍼 ㄷㄷㄷㄷ', '비프리 의외네?ㅋㅋㅋㅋㅋ', '누군지 모르는데 걍 이름 알리고 싶나보네']"
둘다임 저 비프리는,"['오늘자 전장연 지지한 래퍼 ㄷㄷㄷㄷ', '비프리 의외네?ㅋㅋㅋㅋㅋ', '오늘 본 댓글 티키타카중에 가장 재미있었습니다']"
비프스테이크는 앎,"['오늘자 전장연 지지한 래퍼 ㄷㄷㄷㄷ', '비프리 의외네?ㅋㅋㅋㅋㅋ', '프리하지 못한 비프리']"
진작에 뚝배기 깨버렸어야,"['드디어 옳게 된 전장연 시위 대응.jpg', '마지막 짤 ㅋㅋ', '경찰들 고생한다...']"
지들 돈벌이하는거에 다른 장애인들 인식마저 나락가게 만든 1등공신,"['드디어 옳게 된 전장연 시위 대응.jpg', '마지막 짤 ㅋㅋ', '막짤 진짜 ㅋㅋㅋㅋ 하']"
막짤ㅋㅋㅋ  극락,"['드디어 옳게 된 전장연 시위 대응.jpg', '마지막 짤 ㅋㅋ', '교통시설 개선이 목적이 아니라는 것이 더 문제']"
막짤 아줌마 임종때 버스타고 가란사람이네 ㅋㅋㅋ,"['드디어 옳게 된 전장연 시위 대응.jpg', '마지막 짤 ㅋㅋ', '아 ㅋ 할 말은 많은데 시발 참는다 ㅋㅋ']"
"역시 갓세훈 전장연과 쎄쎄쎄하던 ""국민의힘 당대표"" 정진석은 사퇴했음 좋겠다","['드디어 옳게 된 전장연 시위 대응.jpg', '마지막 짤 ㅋㅋ', '재네때문에 장애인 전체가 혐오대상이 되버림']"
체포해도 될거같은데 ㅋㅋ,"['드디어 옳게된 전장연 시위 대응법', '출근길마다 ㅈ같았던 팸붕이들에게 통쾌한 소식', '저 할머니 자꾸 방송 나오는거보니 나름 전장연 간부급 인사인듯?']"
장애인의 죽빵은 성인 남성의 죽빵과 다른가? 왜 맞기만 해야하는가,"['오늘 전장연으로부터 시민을 지키려 헌신하신 분들', 'https:n.news.naver.comarticle0080004835696                2일 오후 12 시9분쯤 삼각지역에서 전장연 회원과 경찰 간 충돌이 발생해 주변 사람들이 말리는 모습.                2일 오후 4시 38 분 지하철에 탑승하려는 전장연 회원과 이를 막으려는 경찰들 모습 전장연 회원이 전동 휠체어를 끌고 지하철로 들어가려고 하자 서울교통공사 직원들과 경찰이 휠체어를 뒤로 끌고 있다                2일 오후 4시 38 분 지하철에 탑승하려는 전장연 회원과 이를 막으려는 경찰들 모습 아침부터 점심까지, 점심부터 오후 늦게까지 거의 하루 종일 전장연에게서 시민을 지키려고 애쓰신 경찰관님들과 지하철 공사 직원 분들, 감사합니다! 길고도 험난했던 하루가 끝나고 블라인드에 올라온 경찰관님 글 https:n.news.naver.comarticle0280002621801 수고 하셨습니다! Thank you for Your Service', '역시 마음대로 안 풀리면 전동 휠체어 돌진은 또 나오는구나']"
저야말로 헛소리 자주 해도 블라인드를 안해주시니 고맙습니다.ㄷㄷ,"['주식X)서로 알지를 모르니 별 수 없지..', '그냥 사는 사회가 자기 앞가림 하기도 존나 힘든 상황이고 나만 존나 힘든 것 같지 뭐. 그걸 지 멋대로 표현하면 저기 민노총이나 전장연처럼 되는 거고. 나랑 다른 사람들이 A는 이래서 힘들다, B는 저래서 힘들다 하다보면 나는 이런 것만도, 저런 것만도 못하는데? 하는 생각 드는 거고. 연봉을 나보다 2배 좀 안되게 버는 친구가 세금 내느라 힘들다고 나한테 그러면 이런 상황에서 아 난 그 정도 세금 내보고 싶다고. 이런 생각 드는 사람들이 대부분일텐데.. 다른 입장에 있는 사람이 자신을 이해해주길 바라는 건 엄청나게 힘든 일이라고 생각함. 다만, 그런 걸 좀 더 객관적인 시각에서 처리해줘야 할 사람들이 있는데 내가 보기엔 그 사람들이 그 역할을 못하는 것 같음. 그러니 각종 갈등이 심해지고.. 더 이상 얘기하면 여기 게시판 성격이랑 안 맞을테니 줄이겠음. 결론은.. 서로 좀 다르게 생각하는 부분도 이해해주려고 해보고 힘내자구요..', '블라 안하셔서 압도적 감사 😇😇😇 악의 0인 댓인거 아시쥬? 😇😇😇']"
래더 매치하냐?,"['전장연 TLC 매치....jpg', '이러면서 탑승할 권리를 달라고?ㅋㅋㅋㅋㅋㅋㅋㅋㅋ', '아베총쏜놈 좀 데려와라ㅋㅋ']"
버러지새끼들이 뭔 개소리를 하냐 ㅋㅋ,"['설마 이거 전장연이 감성팔이하는거야?', '비장애인도 탈수있지만 깽판치는 비장애인만 못타게하는건데 뭔솔', '존나 꼴값...']"
모순을 견디는 것 ㅋㅋㅋㅋㅋ 비장애인 ㅇㅈㄹ 차별을 그냥 면전에 갈기시네,"['설마 이거 전장연이 감성팔이하는거야?', '비장애인도 탈수있지만 깽판치는 비장애인만 못타게하는건데 뭔솔', '그냥 타지마라']"
"보통 좌파도 아니고 ""자본주의와 맞서 싸웁시다"" 같은 소리를 하고 다니는 아주 위험하신 분임","['[속보] 경찰, ‘지하철 탑승 시위’ 전장연 회원 24명 검찰 송치', 'https:n.news.naver.commnewsarticle0210002549458?sid=102 자 드가자~', '전장연=좌파=민주당=끄덕']"
님처럼 하루종일 폰에 대가리박으면서 펨코하진 않는데요 ㅋ,"['전장연 돌격대장.mp4', '.', '꼴에 ㅂㄷㅂㄷ거리면서 신고했나보네ㅋㅋ']"
뭐야? 정신적으로도 장애가 있는 사람이었나?? 왜저런거임?,"['전장연 돌격대장.mp4', '.', 'ㅋㅋㅋㅋㅋㅋㅋ맛잇다ㅋㅋㅋ']"
진짜 존나역겹다,"['고민정 휠체어 출근 챌린지 ㅋㅋㅋ', 'https:www.joongang.co.kramparticle25061381 얘네들도 전장연 입 꾹 쳐닫고 있지? ㅋㅋㅋㅋ', '아임뚜렛이나 저거나 도대체 뭐가 다름?', '아임뚜렛이나 저거나 도대체 뭐가 다름?']"
쟤네는 장애인이 아니라 테러리스트라고 부르자 병신새끼들,"['팔걸고 전장연 못들어오게 막는 교통공사 직원들.jpg', '전국장애인차별철폐연대(전장연)가 2일 지하철 시위를 재개했다. 교통공사 직원들은 시위대가 전동차에 타지 못하게 스크럼을 짜는 방식으로 막았다. 탑승이 어려워지자 전장연 측 관계자들은 탈 수 있을 때까지 대기하겠다며 승강장 문 앞에 대기했 https:n.news.naver.comarticle0080004835316', '궁금한게 일반인들은 어떻게 탐?']"
교통공사 직원들 뒤에 경찰까지 있네 이게 뭔 행정력 낭비냐 ... 그만좀해ㅠ,"['팔걸고 전장연 못들어오게 막는 교통공사 직원들.jpg', '전국장애인차별철폐연대(전장연)가 2일 지하철 시위를 재개했다. 교통공사 직원들은 시위대가 전동차에 타지 못하게 스크럼을 짜는 방식으로 막았다. 탑승이 어려워지자 전장연 측 관계자들은 탈 수 있을 때까지 대기하겠다며 승강장 문 앞에 대기했 https:n.news.naver.comarticle0080004835316', 'ㅋㅋㅋㅋㅋㅋ월 마리아네']"
아침8시구나,"['오늘 전장연 8시 삼각지역에서 시위 예정', '출근하는 펨붕이들 화이팅하자', '지들 기지랑 가까움']"
말만 하지말고 행동으로 좀 처벌해라,"['전장연 새해 첫 출근길 지하철 1박2일 시위 예고', '- 전장연 1월 2 - 3일 1박 2일 간 지하철 시위 재개 - 오세훈 서울시장 “시위 재개 선언은 용납할 수 없다”, “불법에 관한 한 이제 더 이상의 관용은 없다,  민·형사상 대응을 포함해 필요한 모든 법적인 조치를 다 하겠다” http:www.ggilbo.comnewsarticleView.html?idxno=953657', '과태료 존나 씨게 쳐먹이면좋겠다']"
찢갈이네ㅋㅋㅋ 찢이란 말에 반응 하는거보니ㅋㅋㅋㅋ,"['전장연 “휴전 끝, 내달 2~3일 지하철 시위 재개할 것”', '전국장애인차별철폐연대(전장연)는 25일 “이제 휴전은 끝났다”며 예산 쟁취를 목표로 오는 1월 2~3일 삼각지역을 중심으로 ‘지하철 행동’을 재개한다고 밝혔다. 전장연은 지난 20일 오세훈 서울시장의 휴전 제안을 받아들여 국회 예산안 처리 때까지 출근길 지하철 시위를 중단하겠다고 밝혔다. 그런데 24일 국회 본회의를 통과한 내년도 정부 예산에 단체가 요구한 장애인 권리 예산의 극히 일부만 반영되면서 시위 재개를 결정했다. (중략) 한편 전장연은 다음 달 2일 법원의 조정안을 받아들일지도 발표할 예정이다. 지난 19일 서울중앙지법은 서울교통공사가 전장연과 박경석 대표 등을 상대로 낸 손해배상 소송에서 ‘엘리베이터 설치(공사)’와 ‘시위 중단(전장연)’을 골자로 한 강제조정을 결정했다. 법원은 전장연에 열차 운행을 5분 넘게 지연시키는 시위를 하지 않고 이를 위반하면 1회당 500만원을 공사에 지급하도록 했다. 기사링크 https:v.daum.netv20221225153300422 추워서 쉰거 아님?', '두창견 찐따새끼 블라튀 ㅋㅋㅋㅋ']"
소방서에서 불 끄러 갈 때도 시의회 의결 받아야겠네?,"['전장연 “휴전 끝, 내달 2~3일 지하철 시위 재개할 것”', '전국장애인차별철폐연대(전장연)는 25일 “이제 휴전은 끝났다”며 예산 쟁취를 목표로 오는 1월 2~3일 삼각지역을 중심으로 ‘지하철 행동’을 재개한다고 밝혔다. 전장연은 지난 20일 오세훈 서울시장의 휴전 제안을 받아들여 국회 예산안 처리 때까지 출근길 지하철 시위를 중단하겠다고 밝혔다. 그런데 24일 국회 본회의를 통과한 내년도 정부 예산에 단체가 요구한 장애인 권리 예산의 극히 일부만 반영되면서 시위 재개를 결정했다. (중략) 한편 전장연은 다음 달 2일 법원의 조정안을 받아들일지도 발표할 예정이다. 지난 19일 서울중앙지법은 서울교통공사가 전장연과 박경석 대표 등을 상대로 낸 손해배상 소송에서 ‘엘리베이터 설치(공사)’와 ‘시위 중단(전장연)’을 골자로 한 강제조정을 결정했다. 법원은 전장연에 열차 운행을 5분 넘게 지연시키는 시위를 하지 않고 이를 위반하면 1회당 500만원을 공사에 지급하도록 했다. 기사링크 https:v.daum.netv20221225153300422 추워서 쉰거 아님?', '정치적 허락은 시의회에서 허죠?']"
아시발 연말에 안되서 연초로 약속 다 미뤘는데,"['전장연 “휴전 끝, 내달 2~3일 지하철 시위 재개할 것”', '전국장애인차별철폐연대(전장연)는 25일 “이제 휴전은 끝났다”며 예산 쟁취를 목표로 오는 1월 2~3일 삼각지역을 중심으로 ‘지하철 행동’을 재개한다고 밝혔다. 전장연은 지난 20일 오세훈 서울시장의 휴전 제안을 받아들여 국회 예산안 처리 때까지 출근길 지하철 시위를 중단하겠다고 밝혔다. 그런데 24일 국회 본회의를 통과한 내년도 정부 예산에 단체가 요구한 장애인 권리 예산의 극히 일부만 반영되면서 시위 재개를 결정했다. (중략) 한편 전장연은 다음 달 2일 법원의 조정안을 받아들일지도 발표할 예정이다. 지난 19일 서울중앙지법은 서울교통공사가 전장연과 박경석 대표 등을 상대로 낸 손해배상 소송에서 ‘엘리베이터 설치(공사)’와 ‘시위 중단(전장연)’을 골자로 한 강제조정을 결정했다. 법원은 전장연에 열차 운행을 5분 넘게 지연시키는 시위를 하지 않고 이를 위반하면 1회당 500만원을 공사에 지급하도록 했다. 기사링크 https:v.daum.netv20221225153300422 추워서 쉰거 아님?', '테러엔 무관용 제발']"
스윗당뇨세훈아 뭐하냐 보수 맞냐 두창이도 화물연대 지지율 올리는 제물로 취급하는 마당에 너는 대체 뭐 약점이라도 잡혀서 안 잡는 거냐,"['전장연 “휴전 끝, 내달 2~3일 지하철 시위 재개할 것”', '전국장애인차별철폐연대(전장연)는 25일 “이제 휴전은 끝났다”며 예산 쟁취를 목표로 오는 1월 2~3일 삼각지역을 중심으로 ‘지하철 행동’을 재개한다고 밝혔다. 전장연은 지난 20일 오세훈 서울시장의 휴전 제안을 받아들여 국회 예산안 처리 때까지 출근길 지하철 시위를 중단하겠다고 밝혔다. 그런데 24일 국회 본회의를 통과한 내년도 정부 예산에 단체가 요구한 장애인 권리 예산의 극히 일부만 반영되면서 시위 재개를 결정했다. (중략) 한편 전장연은 다음 달 2일 법원의 조정안을 받아들일지도 발표할 예정이다. 지난 19일 서울중앙지법은 서울교통공사가 전장연과 박경석 대표 등을 상대로 낸 손해배상 소송에서 ‘엘리베이터 설치(공사)’와 ‘시위 중단(전장연)’을 골자로 한 강제조정을 결정했다. 법원은 전장연에 열차 운행을 5분 넘게 지연시키는 시위를 하지 않고 이를 위반하면 1회당 500만원을 공사에 지급하도록 했다. 기사링크 https:v.daum.netv20221225153300422 추워서 쉰거 아님?', '일렬로 줄세우고 죽창으로 싹다 대가리 뚫어야됨']"
요구? 애초에 쟤네 본질은 좌파정치단체라 요구 들어달라는게 순수한 목적아님ㅋㅋ 걍 우파 방해하는게 목적이지 게다가 지금 우파도 병신이라 병먹금못하고 끌려다니다못해 앞에가서 무릎꿇고있는게 문제고,"['전장연 오늘 퇴근시간(6시)에 또 날뛴데', '이젠 한숨도 안나온다', '더 내놔']"
시민님들아 늬들이 버린 이준석이니 악으로 깡으로 버티세요 팽할땐 언제고 이제와서 불편하다 호소해?,"['전장연 오늘 퇴근시간(6시)에 또 날뛴데', '이젠 한숨도 안나온다', '아 시발 좀 작작해 집 좀 가자']"
한도없는 카드 맘껏 써 결제는 호구인 국민이 어이 ㅆㅂ,"['명함 돌리며 공손하게 전장연과 면담을 하는 주호영', '???: 불법과 타협하지 않겠다~~~~!!!', '카드 돌리는 줄']"
이런 애들이 있어서 틀딱들이 득세하고 민주당이 아직도 존재하는듯 ㅋㅋㅋㅋ,"['충격주의)전장연 내놔라 공공임대 챌린지.jpg', '아... 할말을 잃음 불법을 저질렀으면 교도소 가야지... 아니 근데 진짜 신기하게 이 할아버지가\xa0 방송에 펨코 출연해주었음 ㅋㅋㅋㅋ', '혼자 썬다고 썰리냐? 정치권에서 같이 옹호하는 새끼 하나없던데 오히려 장애인갈라치기한다고 같은 진영에서도 공격하더만 니들같은 애들이 정치권에 한트럭이야']"
정부도 질질 끌려다니는데 이준석이 몇개월만에 끝을 낸다고? 시발 진짜 경계선 지능인가? 이론상으로 가능하긴함? 게다가 시작도 하기 전에 두창이가 끌어내렸잖아,"['충격주의)전장연 내놔라 공공임대 챌린지.jpg', '아... 할말을 잃음 불법을 저질렀으면 교도소 가야지... 아니 근데 진짜 신기하게 이 할아버지가\xa0 방송에 펨코 출연해주었음 ㅋㅋㅋㅋ', '그냥 놀아주는 거임. 요새 정치답도 없어서 정갤도 거의 안가고 있는데. 헛소리하는 거보니까 답답하긴하네']"
캬 ㅋㅋㅋ,"['전장연 근황.news', '조계사 대웅전 점거함... 스님들 무슨 날벼락... 그나저나 이제 지하철에서 절로 옮겨간건가?? 아니면 지하철도 계속 하는건가...', '미안 가방끈이 짧아서... 부끄럽다ㅎㅎ..']"
이준석이 문제를 제기했을 때 병신새끼들이 전장연의 편에 서서 사태를 악화시키고 장기화 되게 만들어버림 씨발 전 세계 유래없는 보수정당이 PC충 ㅋㅋㅋㅋㅋㅋㅋㅋㅋㅋㅋㅋ,"['[속보] 전장연 4호선 시위 진행 中... 지연 우려', '[속보] 전장연 4호선 시위 진행 中... 지연 우려 < 뉴스일반 < 기사본문 - 핀포인트뉴스 (pinpointnews.co.kr) 아주 나라꼴보소.\xa0 오늘도 저 ㅈㄹ 하는데 말도 못하는 ㅅㄲ들 준서기 전장연 비판할때 개소리하던 국힘당 ㅅㄲ들 뭐하냐? 아주 개호구 됬구만', '씨발 청소 아줌마들만 고생하겠네...']"
더러운 새끼들. 너그들 때문에 장애인에 대한 생각이 완전히 바뀌었다.,"['전장연 수능날까지 시위 중단.jpg', 'https:m.wikitree.co.krarticles806238#_enliple 지네들도 수능날 그러면 목숨이 감당 안될걸 아나보네', '고소 이전에 부모들한테 쳐 맞고 장애이력 추가될듯']"
여당 중진들이 김재섭 팔뚝만큼만 뚝심 있었으면 나라가 이 지랄 안 났지,"['<김재섭 페이스북> 전장연의 요구는 여기서 끝나지 않을 것이다', '.', '전장연만 저러겠나? 이제 심심하면 약자들 앞세워서 땡깡피면 뭔수로 막으려고. 진짜 우파도 아닌 기회주의자쓰레기들이 이것들이 진짜 빨갱이야', '전장연만 저러겠나? 이제 심심하면 약자들 앞세워서 땡깡피면 뭔수로 막으려고. 진짜 우파도 아닌 기회주의자쓰레기들이 이것들이 진짜 빨갱이야']"
요즘 간간히 오다보니까 업데이트가 느림 ㅋㅋㅋ 차기 대선후보도 유승민이 1위 땃음?? 당대표인줄 알았는데,"['오세훈 쉴드를 좀 치자면', '오세훈은 비주류에 새보계로 분류될만큼 당내에서 입지가 좁음 전장연 건드렸다가 이준석 그 엄청난 폭격 맞았는데 지금도 차기대선 지지율 1위 나와서 윤석열 심기 불편할건데 나서지 못하는것도 있을거라고봄', '최근 조사한걸로 치면 한동훈이 국힘내에서 1위 전체로 따지면 유승민이 1위였을껄 오세훈은 홍준표랑 비비고 있었고']"
광우병 걸림,"['이나라 국민들은 전장연 욕할 처지도 안됨 ㅋㅋ', '온 공중파랑 언론에서 이준석이 맞는말 했다고 장애인 혐오자로 몰아갔는데 ㅋㅋㅋ 그거에 동조한 국민들이랑', '그래서 나 서울시민들 당하는거 불쌍한 생각 그렇겐 안듬 55퍼면', '그래서 나 서울시민들 당하는거 불쌍한 생각 그렇겐 안듬 55퍼면']"
우리나라 역사에서 좌우파 행보보면 알거임 우파가 시장개입할 때도 있고 좌파가 반대로 푼적도 있음 걍 우리나라에서 그 상식 안 통하고 이해관계랑 정치지형에 따라 정해짐 새삼스럽게 무슨 좌우를 따져ㅋㅋㅋ 걍 좌파 싫다고 까면 모를까,"['전장연이 요구한 장애인 예산 결국 반영', '돈 줬으니 이제 며칠 시위 안해줄게 내일 아침 기자회견 ㅋㅋㅋㅋㅋ 이나라는 떼쓰면 테러리스트의 요구도 들어주는 호구병신국가라는게 다시한번 증명이 돼버렸다', '아니 그런뜻이 아니라 보여주는 행보가 누구보다 좌파스럽잖아 ㅋㅋㅋㅋㅋ 보수라면 근본적으로 시장을 믿는 모습을 보여야 하는데 누구보다 좌파스럽게 시장 개입하는데 ㅋㅋㅋ 좌파 우파를 부정적으로 한 게 아니라 난 경제적 관점에서 말한 거임']"
그냥 나라의 국운이 다 한거 같다,"['전장연이 요구한 장애인 예산 결국 반영', '돈 줬으니 이제 며칠 시위 안해줄게 내일 아침 기자회견 ㅋㅋㅋㅋㅋ 이나라는 떼쓰면 테러리스트의 요구도 들어주는 호구병신국가라는게 다시한번 증명이 돼버렸다', '결국 역사에 남을 선례를 남기는구나']"
테러단체ㅋㅋㅋㅋㅋㅋㅋㅋ,"['전장연이 요구한 장애인 예산 결국 반영', '돈 줬으니 이제 며칠 시위 안해줄게 내일 아침 기자회견 ㅋㅋㅋㅋㅋ 이나라는 떼쓰면 테러리스트의 요구도 들어주는 호구병신국가라는게 다시한번 증명이 돼버렸다', '센터장이면 4천 넘지ㅋㅋㅋㅋㅋㅋㅋㅋㅋㅋㅋ못해도 5천 6천은 받지 않음?']"
민주당이 180석인데?? 뭘막음??생각좀 ㅋㅋ,"['전장연이 요구한 장애인 예산 결국 반영', '돈 줬으니 이제 며칠 시위 안해줄게 내일 아침 기자회견 ㅋㅋㅋㅋㅋ 이나라는 떼쓰면 테러리스트의 요구도 들어주는 호구병신국가라는게 다시한번 증명이 돼버렸다', '막을수 있던걸 즈그가 막타쳤으니까 하는말이지.. 생각좀']"
병신들,"['전장연이 요구한 장애인 예산 결국 반영', '돈 줬으니 이제 며칠 시위 안해줄게 내일 아침 기자회견 ㅋㅋㅋㅋㅋ 이나라는 떼쓰면 테러리스트의 요구도 들어주는 호구병신국가라는게 다시한번 증명이 돼버렸다', '떼쓰면 들어주는 스레기 새끼들 짓 하지 말라고 뽑아줬더니 떼쓰면 들어주는 스레기 새끼들 진짜 다 나가 뒈져라 개새끼들아']"
이 씨발  문재인때보다 나아진게 뭐냐고,"['전장연이 요구한 장애인 예산 결국 반영', '돈 줬으니 이제 며칠 시위 안해줄게 내일 아침 기자회견 ㅋㅋㅋㅋㅋ 이나라는 떼쓰면 테러리스트의 요구도 들어주는 호구병신국가라는게 다시한번 증명이 돼버렸다', '애미뒤진 병신국가. 장애인은 무슨 쳐죽일 빨갱이 ㅅㅋ들, 테러리스트들 요구 들어주면 끝일거 같냐? 대체 무슨 생각으로 저 ㅅㅋ들 요구에 굴복하는건데']"
